{
    "general":{
        "pout":"outputdir",
        "nodata":-10000,
        "ram":1024,
	"nb_threads":1,
	"generate_vector":false,
	"preprocessing":false,
	"log":true
    },
    "inputs":{
	"green_band": {
	    "path": "/filepath2/test2/green.tif",
	    "noBand": 1
	},
	"red_band": {
	    "path": "/filepath1/test1/red.tif",
	    "noBand": 1
	},
	"swir_band": {
	    "path": "/filepath3/test3/swir.tif",
	    "noBand": 1
	},
        "dem":"inputdem",
        "cloud_mask":"inputcloud"
    },
    "cloud":
    {
        "shadow_mask":64,
        "all_cloud_mask":0,
        "high_cloud_mask":32,
        "rf":8,
        "red_darkcloud":650,
        "red_backtocloud":100
    },
    "snow":{
        "dz":100,
        "ndsi_pass1":0.4,
        "red_pass1":200,
        "ndsi_pass2":0.15,
        "red_pass2":120,
        "fsnow_lim":0.1,
        "fsnow_total_lim":0.001
    }
}

